<?xml version="1.0" ?>

<!DOCTYPE absencoid SYSTEM "absencoid.dtd">

<absencoid xmlns="http://mosra.bloguje.cz/absencoid/">
    <update version="1">
        <date>2009-07-25</date>

        <note>
            Vítejte! Právě stahujete první aktualizaci Absencoidu. Přidávám vám
            sem jeden rozvrh, pár předmětů a nějaké ty změny. Hákujte jak o život!
            Také se změnila adresa pro aktualizaci z internetu, protože ostatní
            aktualizace bude dělat konečně už někdo jiný než já.
        </note>

        <configuration>
            <beginDate>2009-09-07</beginDate>
            <endDate>2010-01-29</endDate>
            <webUpdateUrl>http://disk.jabbim.cz/mosra@jabbim.cz/absencoid-update.xml</webUpdateUrl>
        </configuration>

        <teachers>
            <teacher id="p1" counts="false" accepts="true">Slušná</teacher>
            <teacher id="p2" counts="true" accepts="false">Zlá</teacher>
            <teacher id="p3" counts="true" accepts="true">Poctivý</teacher>
            <!-- ... -->
        </teachers>

        <classes>
            <class id="c1" teacherId="p1">Aj</class>
            <class id="c2" teacherId="p1">Nj</class>
            <class id="c3" teacherId="p1">F</class>
            <!-- ... -->
        </classes>

        <timetables>
            <timetable id="t1" next="t1">
                <name>Hlavní rozvrh</name>
                <validFrom>2009-09-07</validFrom>
                <lessons>
                    <lesson classId="c1" fixed="true">
                        <day>0</day>
                        <hour>1</hour>
                    </lesson>
                    <lesson classId="c2" fixed="true">
                        <day>0</day>
                        <hour>2</hour>
                    </lesson>
                </lessons>
            </timetable>
            <!-- ... -->
        </timetables>

        <changes>
            <change id="x1">
                <!-- Tento den odpadají všechny hodiny -->
                <date>2009-09-07</date>
                <allHours />
                <allClasses />
                <toClass />
            </change>
            <change id="x2">
                <!-- V pondělí přibyla nultá hodina -->
                <date>2009-09-14</date>
                <hour>0</hour>
                <fromClass />
                <toClass id="c2" />
            </change>
            <change id="x3">
                <!-- V úterý máme další blbou hodinu místo flákací -->
                <date>2009-09-14</date>
                <hour>2</hour>
                <fromClass id="c1" />
                <toClass id="c2" />
            </change>
            <!-- ... -->
        </changes>

    </update>
</absencoid>
